기업명,내용,고용형태,경력,주소1,주소2,기간,직무키워드
주식회사 네오테크,                                튜닝기업 네오테크 김천 신사옥 이전 각 부문별 신규/경력 채용,신입·경력,학력무관,경북 외,경북,~01/06(목),"자동차부품, 광고기획, 라이센싱, 마케팅, 마케팅기획, 바이럴마케팅, 브랜딩, 소셜미디어, 시장분석, 업무제휴, 키워드광고, 판촉, 퍼블리싱, 프로모션, AE, CMO, CRM, IMC, BM, 광고관리, 브랜드, 언론홍보, 이벤트, 프로모션, 홍보, 홍보기획, PR, SNS운영, 바이럴마케팅, 소셜마케팅, 온라인마케팅, 웹광고기획, 웹마케팅, 웹프로모션, 키워드광고, 게시판관리, 베타테스트, 웹사이트운영, 카페·블로그관리, 컨텐츠개발, 컨텐츠관리, 컨텐츠에디터, e-Learning, Helpdesk, 공정, 공정관리, 생산, 생산관리, 안전, 원가관리, 자재관리, 품질, 품질검사, 품질관리, 품질보증, 환경관리, HACCP, ISO, QA, 금속, 기계, 기능직, 밀링, 방전, 사출, 생산직, 설비, 연삭, 용접, 운전, 유리, 절곡, 제관, 제조, 조립, 회로, 비금속, 2D, 3D설계, 건축모형, 건축설계, 금형설계, 기계설계, 기구설계, 전기설계, 조경설계, 토목설계, AutoCad, CAD, CAM, catia, Pro-e"
㈜그로비교육,                                2022년 각 부문별 대규모 채용 [웹디자인/퍼블리시/영상제작PD/영상디자이너/애니메이터/콘텐츠기획/웹ㆍ앱 서비스 기획/서버 개발]                            ,신입·경력,학력무관,서울 외,서울 강남구 외,~01/14(금),"CDN, Back-end, google analytics, js, Maria, LMS, Premiere, SPRING, spring boot, Sketch, UI·UX디자인, 교재제작, 유아교육, MySQL, 네트워크관리, 네트워크엔지니어, 방화벽, 보안관리, 보안기술, 서버관리자, 서버구축, 시스템운영, Linux, 웹기획, 웹서비스기획, 웹PD, MySQL, 안드로이드, 플래시APP, Application, Linux, 시스템프로그래머, 웹사이트운영, 컨텐츠개발, 컨텐츠관리, 웹접근성, 웹퍼블리셔, 웹표준, 자바스크립트, CSS, HTML5, HTML코딩, UI·UX, 모바일UI, 웹UI, 일러스트레이터, 자바스크립트, 포토샵, 플래쉬, CSS, HTML, Sketch, 3DMax, 방송CG, 영상편집, 프리미어, 인코딩, 파이널컷, 그래픽디자인, 시각디자인, 일러스트레이터, 포토샵, 동화디자인, 만화디자인, 모션그래픽, 애니메이션, 애니메이터, 원화디자인, 캐릭터디자인, 프리미어, 플래쉬, 광고디자인, 디지털디자인, 영상디자인, 방송기획, 방송제작, PD·연출, 영상편집, 카메라, 포토샵, 프리미어, 유치원교사, 국사, 수학, 영어, 국어, 수학, 영어, 온라인통신교육, 영어, 영어강사, TEPS, TOEFL, TOEIC, 교육기획, 교육진행, 교재컨텐츠개발, 교육프로그램, 번역, 영어"
위드앤㈜,                                위드앤(주) 각 분야별 채용공고                            ,신입·경력1년↑,학력무관,인천 외,인천 부평구 외,~01/19(수),"소셜커머스, 쇼핑몰, 오픈마켓, 마케팅, 마케팅기획, 바이럴마케팅, 바이어관리, 바이어상담, 영어, 해외마케팅, 해외영업, MD, 상품기획, 상품입출고, 온라인MD, 유통관리, MD, 영업관리, 영업기획, 영업지원, 생산관리, 원가관리, 품질, 영사기사, 영상편집, 촬영보조, 카메라, 포토그래퍼, 포토샵"
㈜비아이,                                2022년 상반기 각 부문 정규직 채용[신입&경력]                            ,신입·경력,초대졸↑,서울,서울 영등포구 외,~12/31(금),"더존, 문서작성, 사무보조, 전산입력, Excel, 4대보험, 경영지원, 더존, 부가세신고, 전산회계, 전표입력, 판매관리, ERP운용, 국내영업, 기술영업, 법인영업, 일반영업, 기술영업, 기술지원, 네트워크영업, 솔루션영업, 시스템영업, 웹사이트구축영업, 하드웨어영업, 가맹점관리, 거래처관리, 고객관리, 매출관리, 영업관리, 영업지원, 채권관리, 기술영업, 법인영업, 일반영업, 해피콜, 회원관리, 고객상담, 고객응대, 고객지원, 인바운드TM, 인터넷쇼핑몰, 콜센터, CS, 고객관리, 회원관리"
엠브이피(MVP),                                분양상담사/모델하우스/(주)베스플러스xPNK 직속 3팀(MVP팀)/ 1군브랜드현장/11기 추가 채용,경력무관,학력무관,서울 외,서울 강남구 외,~01/20(목),"공인중개사, 모델하우스, 부동산개발, 부동산컨설팅, 분양, 문서작성, 사무보조, 가맹점영업, 국내영업, 법인영업, 상조영업, 일반영업, 아웃바운드TM, 고객상담, 고객응대, 고객지원, 광고, 부동산, 인바운드TM, 증권·투신, 콜센터, CS, 공인중개사, 모델하우스, 부동산, 부동산개발, 부동산경매, 부동산시행, 부동산컨설팅, 분양대행, 분양상담사, 아파트·빌라, 양도·양수, 임대·임대컨설팅, 주택관리사, 상가·사무실, 영업·홍보"
㈜비에스에스컴퍼니,                                UI UX디자이너/ IOS개발자/ JAVA개발자/ 온라인서비스 운영관리 - 각 부문 채용,신입·경력2년↑,학력무관,서울 외,서울,~01/10(월),"모바일UI, 웹디자인, 웹UI, 포토샵, 백엔드개발, 아키텍쳐, 프론트엔드개발, 프론트엔지니어, AWS, codeigniter, Custom UI, IOS, JavaScript, MVVM, Nodejs, MVP, PHP Framework, React, springboot, SWIFT, Sketch, UI프로토타이핑, UI·UX디자인, MobX, GIT형상관리, Next.js, next, RIBs, 레거시코드분석, styled components, IOS Native앱, 모바일앱개발, 소프트웨어개발, 솔루션, asp, WAS, 기획조사, 사업제휴, 서비스기획, 문서관리, 문서작성, 전산입력, 정보처리, 정보처리기사, 홈페이지관리, OA, CS, QA, 리눅스, 웹마스터, QA, MySQL, 네트워크관리, 서버관리자, Linux, 웹기획, 웹서비스기획, UI설계, 웹마케팅, 웹프로모션, 웹프로그래머, HTML, Java, mHTML, MS-SQL, MySQL, php, SQL, 아이폰, 플래시APP, Application, Linux, 웹사이트운영, 컨텐츠관리, 웹접근성, 웹퍼블리셔, 웹표준, 자바스크립트, CSS, CSS3, HTML5, HTML코딩, UI·UX, 모바일UI, 웹UI, 자바스크립트, 포토샵, CSS, GUI, HTML, Sketch, UI·UX디자인, QA, GUI, 스포츠, 웹컨설팅"
프리미엄멀티샵,                                [청년내일채움공제]인사/경영관리부/바잉 MD/온라인MD/마케팅/CRM 마케팅 /웹디자이너/유투브/영업물류/포토그래퍼 어시스트 공개채용,신입·경력2년↑,초대졸↑,경기 외,경기 수원시 외,~01/23(일),"Sketch, UI·UX디자인, 유통, 유통관리, 경영기획, 기획, 서비스기획, 문서관리, 문서수발, 사무관리, 사무행정, 총무, 급여관리, 성과관리, 인사, 인사통합, 경영지원, 관리회계, 전산회계, 전표입력, 결산, 재무, 재무회계, 광고기획, 마케팅, 마케팅기획, 바이럴마케팅, 브랜딩, 소셜미디어, 시장분석, 업무제휴, 퍼블리싱, 광고관리, 브랜드, 홍보, 홍보기획, PR, 물류, 자재구매, 구매관리, 상품입출고, 외자구매, 유통관리, 자재구매, 가맹점관리(SV), 리테일MD, 물류, 상품기획, 상품입출고, 온라인MD, 유통관리, 패션MD, MD, 거래처관리, 납품관리, 매출관리, 영업관리, 영업기획, 영업지원, 바이럴마케팅, 소셜마케팅, 온라인마케팅, 웹광고기획, 웹마케팅, 쇼핑몰, 카페·블로그관리, 컨텐츠관리, 컨텐츠에디터, 웹퍼블리셔, 자바스크립트, CSS, HTML코딩, UI·UX, 모바일UI, 일러스트레이터, 자바스크립트, 포토샵, CSS, HTML, xml, UI·UX디자인, 영상편집, 프리미어, 인코딩, 파이널컷, 그래픽디자인, 시각디자인, 일러스트레이터, 포토샵, GUI, 광고디자인, 시각디자인, 영상디자인, 영상편집, 촬영보조, 포토그래퍼, 포토샵, 프리미어, 광고기획, 브랜딩"
교원에듀,                                교원그룹 초등 관리교사 (재택) 공개 채용 [서울/수도권/대전/천안/청주]                            ,신입·경력,대졸↑,대전 외,대전 서구 외,~01/20(목),"화상수업, 화상교사, 교사, 방문교사, 학습지, 회원모집상담, 고객상담, 고객응대, 고객지원, 학습지업체, CS, 고객관리, 서비스홍보, 제품홍보, 회원관리, 교육상담, 수강생관리, 안내상담, 프로그램상담, 학원에이전트, 학원운영, 회원관리, 회원유치, 공부방교사, 과외교사, 방문교사, 보육교사, 영어강사, 온라인통신교육, 일어강사, 중국어강사, 학습지교사, 교수설계, 교육기획, 교육진행, 교육행정, 교재컨텐츠개발, 교육프로그램"
㈜데이(THEY),                                2021년 하반기 각 분야 채용모집(웹디자이너/포토그래퍼/의류디자이너/물류관리팀/물류운송팀/경리회계)                            ,신입·경력2년↑,학력무관,서울 외,서울 중구 외,~01/19(수),"근태 관리, 매입매출관리, 차량관리, ㈜데이(THEY), 제품 패킹 및 상하차, 물류, 배송, 운송, 입출고관리, 입하, 출하, 상품기획, 쇼핑몰, 오픈마켓, B2B, B2C, 남성의류, 섬유, 의류, 패션, MD, 결산, 경리, 부가세신고, 세무, 물류, 물류, 물류관리, 배송, 재고관리, 게시판관리, 쇼핑몰, 웹사이트운영, 카페·블로그관리, 일러스트레이터, 포토샵, GUI, HTML, 시각디자인, 아트디렉터, 영상디자인, 남성정장, 남성캐주얼디자인, 디스플레이, 잡화디자인, 사진촬영기사, 스튜디오, 촬영보조, 카메라, 포토그래퍼, 포토샵"
㈜쥬비스다이어트,                                [상반기공채] 다이어트 컨설턴트/컨시어지/CC 채용공고                            ,신입·경력,대졸↑,서울 외,서울 강남구 외,~01/13(목),"항공, 다이어트컨설턴트, 산업심리, 스포츠과학, 식품영양학과, 심리학, 심리학과, 운동컨설턴트, 지상직, 스포츠관련학과, 상담심리학과, 산업심리학과, 리셉션, 안내, 컨시어지, 고객관리, 고객상담, 고객응대, 고객지원, CS, 고객관리, 단순홍보, 제품홍보, 회원관리, 다이어트, 체형관리, 코디네이터, 승무원, 안내, 컨시어지, 공항지상직, 영양사, 운동처방사, 안내, 코디네이터"
(재)삼성개발공원묘원,                                [재단법인 엘리시움] 총무/경리/영업부/내근직 공개채용,신입·경력,학력무관,경기,경기 광주시,~01/03(월),"장례서비스, 경영기획, 경영혁신, 사업기획, 서비스기획, 신규사업·BD, 급여관리, 노무, 노사관리, 목표관리, 성과관리, 인사, 문서관리, 문서작성, 사무보조, 워드, 전산입력, 전산편집, 4대보험, 결산, 경리, 경영지원, 관리회계, 부가세신고, 세무, 출납, 마케팅, 마케팅기획, 바이럴마케팅, 브랜딩, 가맹점영업, 국내영업, 기술영업, 일반영업, 거래처관리, 고객관리, 대리점관리, 매출관리, 영업관리, 고객상담, 고객응대, 인바운드TM, CS, 고객관리, 단순홍보, 서비스홍보, 제품홍보, 홍보상담"
지엠컴,                                [삼성이노베이션뮤지엄] 프리젠터/인포메이션/기획/홍보 채용,경력무관,초대졸↑,서울 외,서울 강남구 외,~12/31(금),"광고대행, 홍보대행, 기획, 기획조사, 서비스기획, 교육기획, 인포메이션, 홈페이지관리, PowerPoint, 마케팅, 마케팅기획, 바이럴마케팅, 시장분석, 판촉, 전시, 전시기획, 고객응대, 바이럴마케팅, 소셜마케팅, 온라인마케팅, 웹마케팅, 컨텐츠개발, 컨텐츠관리, 컨텐츠에디터, 영상편집, 영어, 중국어강사, 통번역"
에어리퀴드솔루션즈코리아(유),                                각 부문 신입/경력직 채용,신입·경력,초대졸↑,충남 외,충남 천안시 외,~12/30(목),"경영기획, 경영혁신, 기획, 기획조사, 변화관리, 사업기획, 서비스기획, 신규사업·BD, 물류, 배차, 자재관리, 자재구매, 창고관리, 국제물류, 납품, 물류, 물류관리, 배송, 재고관리, 창고관리, 택배, 중장비운전, 화물차운전, 운전기사, 구매관리, 물류관리, 물류센터, 상품입출고, 유통관리, 자재구매, 자재구매기획, 재고관리, 물류, 물류관리, 상품기획, 상품입출고, 온라인MD, 유통관리, 재고관리, 창고관리, 고객관리, 영업관리, 영업기획, 영업지원, 고객상담, 고객응대, 고객지원, 고객관리, 단순홍보, 리서치, 서비스홍보, 제품홍보, 홍보상담, 회원관리, 통화품질관리, 고객문의분석, 생산, 생산관리, 안전, 원가관리, 자재관리, 품질, 품질검사, 품질관리, 품질보증, 기술연구소, 기술직, 디스플레이, 반도체, 생산기술, 전기·전자, 정보통신·IT, 제품개발, 회로설계, LCD, LED·AMOLED, PCB, R&D, 연구관리, 제품개발, 화학, 전기·전자회로, 품질엔지니어, 검사, 기술지원, 설치, 수리, 유지보수, 정비, A·S, 설문조사, 시장조사, 조사분석, 통계, 생명공학, 전기·전자, 로봇·자동화, 반도체·LCD, 제조·공정, 화학·섬유"
㈜레어로우,                                2022 레어로우 상반기 정규직 공개 채용,경력,학력무관,서울 외,서울 동대문구 외,~01/13(목),"물류, 유통, 유통관리, 잡화매장, 판매, MD, 광고기획, 마케팅, 마케팅기획, 바이럴마케팅, 브랜딩, 소셜미디어, 퍼블리싱, 프로모션, 자재관리, 자재구매, 자재통합, 구매관리, 물류센터, 상품입출고, 유통관리, 자재관리, 자재구매, 자재구매기획, 자재통합, 재고관리, SCM, 리테일MD, 온라인MD, 유통관리, 재고관리, MD, 거래처관리, 고객관리, 납품관리, 영업관리, 가구판매, 매장관리, 매장시설관리, 매출관리, 샵마스터, 재고관리, 진열관리, 고객상담, 고객응대, 고객지원, 대형할인점, 인터넷쇼핑몰, CS, 고객관리, 제품홍보, 회원관리, 바이럴마케팅, 소셜마케팅, 온라인마케팅, 웹광고기획, 웹마케팅, 웹프로모션, 웹사이트운영, 카페·블로그관리, 컨텐츠개발, 컨텐츠관리, 컨텐츠에디터, 3D설계, 금형설계, AutoCad, CAD, 가구디자인, 공간디자인, 공업디자인, 금속디자인, 산업디자인, 잡화디자인, 제품디자인, 패키지디자인, 팬시디자인, 공간디자인, 실내디자인, 전시디자인"
은민에스엔디,"                                MEP 사업부 - 전기, 건축설비 경력직 채용",경력5년↑,초대졸↑,서울,서울 강남구,~12/31(금),"실내건축, 설계엔지니어, 전기, 전기·전자회로, 전기설비, 건축시공, 건축자재, 공무, 공사감리, 현장관리, 현장소장, 기계설비, 시설관리, 전기공사, 전기설비, 기계관리, 시설관리, 전기관리, 환경관리"
주식회사 트리즈컴퍼니,"                                [트리즈스튜디오] 2022 연출, 콘텐츠 제작PD, 라이브커머스 PD, 작가 채용",신입·경력,학력무관,서울 외,서울,~01/17(월),"광고기획, 광고대행, 광고디자인, 광고제작, 온라인광고, 이벤트대행, 프로모션대행, 홍보대행, 컨텐츠, 포털, 광고영업, 매체광고영업, 온라인광고영업, 키워드광고, 웹서비스기획, 웹PD, 제안·컨설팅, 컨텐츠기획, 바이럴마케팅, 소셜마케팅, 온라인마케팅, 웹광고기획, 웹마케팅, 웹프로모션, 키워드광고, 웹사이트운영, 컨텐츠개발, 컨텐츠관리, 컨텐츠에디터, 포토샵, UI·UX디자인, 방송CG, 영상편집, 프리미어, 인코딩, 파이널컷, 포토샵, 광고디자인, 시각디자인, 영상디자인, TV광고, 방송기획, 방송제작, AD·조연출, FD·연출보조, PD·연출, 방송기술, 방송송출·송신, 방송카메라기사, 방송CG, 사진촬영기사, 영상편집, 촬영보조, 카메라, 포토그래퍼, 포토샵, 프리미어, 광고제작, 광고PD, 사진기자, 인터넷기자, 잡지·사보기자, 촬영기자, 구성작가, 대본, 방송작가, 스크립터, 시나리오작가, 작가"
㈔한국산업지능화협회,"                                2022년 각 부문 경력 및 신입 채용[교육사업 운영/관리, 산업데이터 표준화 사업 관리/운영, 산업 디지털 전환 협업 지원센터, 회계/세무]                            ",신입·경력,초대졸↑,경기 외,경기 성남시 외,~03/17(목),"컴퓨터, 스마트제조, 사단법인, 협회, 경영기획, 기획, 사업기획, 서비스기획, 신규사업·BD, 전략, 타당성분석, 공무, 관리, 문서관리, 사무관리, 교수설계, 교육, 교육기획, 교육훈련, 4대보험, 결산, 경리, 경영지원, 더존, 부가세신고, 세무, 예산관리, 회계, ERP운용, 결산, 세무, 자금, 재무, 재무기획, 재무회계, 통계, 데이터베이스, 데이터마이닝, 인공지능(AI), 빅데이터, 데이터분석, 하드웨어, 소프트웨어, 전기, 하드웨어"
DL이앤씨㈜,                                2022년 DL이앤씨 신입사원 채용,신입,대졸↑,서울 외,서울,~01/07(금),"건설, 인사, 인사기획, 원가회계, 회계, 재무, 재무기획, 재무회계, 건설자재, 구매관리, 데이터베이스, MS-SQL, MySQL, SQL, 데이터마이닝, 네트워크관리, 네트워크엔지니어, 서버관리자, 서버구축, 시스템운영, 통계·로그분석, MS-SQL, MySQL, SQL, 응용프로그래머, 전산전공, SQL, 시스템프로그래머, 시스템분석, 시스템설계, 시스템엔지니어, Python, 빅데이터, R, 데이터분석, 공정, 공정관리, 안전, 품질관리, 환경관리, 설비, 신소재, 건설, 건축, 제어, 플랜트, 환경, 건축모형, 건축설계, 건축설비설계, 전기설계, 토목설계, 네트워크엔지니어, 전자통신, 정보통신, 통신공사, 통신기술, 건축설계, 건축시공, 실내건축, 건설현장, 건축감리, 건축시공, 건축자재, 건축CM, 설계감리, 소방감리, 시공, 시공감리, 토목감리, 토목, 토목기사, 도시계획, 계측, 건설안전, 건축설비, 공조냉동, 기계설비, 산업안전, 소방설비, 안전, 전기공사, 전기기사, 전기배선, 전기설비, 품질관리, 통신설비, 소방·방재, 전기점검, 플랜트, 환경, 환경기사, 산업안전, 산업안전기사, 소방, 안전, 전기공사, 전기관리, 건설·교통, 신소재개발"
한국교원단체총연합회,                                한국교총 웹디자이너 채용(계약직)                            ,신입·경력1년↑,고졸↑,서울,서울 서초구,~12/31(금),"UI·UX디자인, 연합회, 드림위버, 모바일UI, 웹UI, 일러스트레이터, 포토샵, 플래쉬, CSS, GUI, HTML, UI·UX디자인, 3D, 3DMax, 그래픽디자인, 디렉터, 시각디자인, 포토샵, POP, 북디자인, 편집디자인(IBM), 광고디자인, 전단지디자인"
유로렌트카㈜,                                유로렌트카(주) 관리부 / 지점별 배차팀 채용,경력무관,고졸↑,경기 외,경기 고양시 외,~01/16(일),"미수관리, 배회차, 보험청구, 렌트카 차량관리, 입금/미수관리, 렌트카 정비관리, 유로렌트카, 대여, 렌터카, 경영기획, 기획, 사업기획, 사업제휴, 문서작성, 사무보조, OA, 배차, 거래처관리, 고객관리, 외주관리, 고객응대, 고객지원, 주유, 주차관리, 주차안내, 보험심사·청구, 경영지원, 고객관리, 금융사무, 입출금관리, 채권관리, 채권추심"
㈜코리아써키트,                                ㈜코리아써키트 각 부문 수시[경력/신입] 채용,신입·경력1년↑,학력무관,경기,경기 안산시,~01/02(일),"PCB, 영업관리, 외주관리, 채권관리, 웹프로그래머, MS-SQL, MySQL, 응용프로그래머, 전산전공, 공정, 공정관리, 생산, 생산관리, 원가관리, 자재관리, 품질, 품질검사, 품질관리, 품질보증, 환경관리, QA, 금속, 기능직, 설비, 회로, 기능직, 도금, 기계, 기구설계, 기술연구소, 기술직, 연구관리, 연구원, 제품개발, 플랜트, 기구설계, 기술연구소, 기술직, 반도체, 생산기술, 연구관리, 연구원, 전기·전자, 제어, 제품개발, 회로설계, 기구설계, 기술연구소, 기술직, 생산기술, 연구관리, 연구원, 환경, 공정엔지니어, 설계엔지니어, 전기, 전기·전자회로, 테스트엔지니어, 품질엔지니어, 회로설계, PCB, 기계설비, 산업안전, 안전, 환경, 환경기사, 환경관리, 환경, 기계·자동차, 로봇·자동화, 연구·실험·기술"
전우APS,                                [수입차부품]구매팀 (수입부-영문메일교신) 신입/경력 채용 - 서울 영등포                            ,신입·경력,학력무관,서울,서울 영등포구 외,상시채용,"견적, 물류창고, 발주, 수입차 부품, 수입차부품영업, 자동차 부품영업, 자동차 부품, 택배포장, 화물포장, 무역업, 상사, 물류, 유통, 유통관리, 판매, MD, 물류, 외자구매, 원부자재관리, 자재관리, 자재통합, 창고관리, 무역일반, 바이어개발, 바이어관리, 바이어상담, 수출입계약, 영어, 해외마케팅, 해외영업, 무역, 무역사무, 무역영어, 수출입무역, 오더관리, 외자구매, 통관, 통관대리인, 포워딩, 물류관리, 상품입출고, 자재관리, 재고관리, 국내영업, 납품영업, 법인영업, 일반영업, 자동차영업, 장비영업, 거래선개발관리, 거래처관리, 고객관리, 납품관리, 대리점관리, 매출관리, 영업관리, 영업기획, 영업지원, 외주관리, 채권관리, 기술영업, 납품영업, 법인영업, 일반영업, 장비영업, 매출관리, 재고관리, 판매관리, 판매영업, 홍보판촉, 쇼핑몰, 아웃바운드TM, 택배·물류, 해피콜, 회원관리, 고객상담, 고객응대, 고객지원, 인바운드TM, 인터넷쇼핑몰, 콜센터, 택배·운송, CS, 고객관리, 단순홍보, 서비스홍보, 제품홍보, 홍보상담, 회원관리"
팀호완코리아,                                미쉐린 딤섬 레스토랑 팀호완 2022년 상반기 정규직원 채용,신입·경력,고졸↑,서울,서울 강남구 외,~12/31(금),"메뉴개발, 주방, 메뉴개발, 메뉴기획, 식품, 음식료, 중식당, 퓨전푸드, 프랜차이즈, 패밀리레스토랑, 매장관리, 매장시설관리, 매출관리, 식품판매, 진열관리, 판매관리, 판매영업, 홀써빙, 식품가공·개발, 요리사, 조리사, 주방보조, 주방장, 중식, Chef"
㈜한국검수,                                인천항 수출입 화물 검수사 / 일반사무직 각분야 채용,경력무관,고졸↑,인천,인천 중구 외,~01/16(일),"검수, 검수사, 입하, 무역업, 관리, 문서관리, 사무관리, 인허가업무, 문서관리, 문서작성, 사무보조, 전산편집, Excel, OA, 물류, 자재관리, 창고관리, 국제물류, 무역, 무역사무, 선적, 수출입무역, 통관, 포워딩, 해운"
㈜리얼피에셋컨설팅,                                회계경력 채용 및 인재 모집                            ,신입·경력,학력무관,서울,서울 용산구,~01/09(일),"공인중개사, 부동산개발, 부동산관리, 부동산금융, 부동산중개, 4대보험, 결산, 관리회계, 더존, 부가세신고, 원가, 원가회계, 전산회계, 전표입력, 출납, 판매관리, 회계, 회계감사, 세무, 재무, 재무회계, 고객응대, 고객지원, 안드로이드, 응용프로그래머, 전산전공, 증강현실, API, C++, C++Builder, Delphi, 웹사이트운영, 웹접근성, 웹퍼블리셔, 웹표준, 자바스크립트, 공인중개사, 부동산, 부동산개발, 부동산시행, 부동산컨설팅, 분양대행, 영업·홍보"
