기업명,내용,고용형태,경력,주소1,주소2,기간,직무키워드
㈜트랜스코스모스코리아,                                당사 데이터 분석 및 사업 기획 담당자 채용,경력무관,학력무관,서울 외,서울 영등포구 외,~12/29(수),"아웃소싱, 콜센터, 경영기획, 기획, 기획조사, 사업기획, 서비스기획, 인공지능(AI), 빅데이터, 챗봇(Chatbot), 데이터분석, 설문조사, 시장조사, 조사분석, 통계"
㈜아이씨디,                                (주)아이씨디 공정팀/RF팀 신입/경력사원 채용,신입·경력,고졸↑,경기,경기 안성시,~01/27(목),"디스플레이, 연구원, LED·AMOLED, R&D, 공정엔지니어, 설계엔지니어, OrCAD, PLC, RF, 3D설계, 기계설계, 기구설계, AutoCad, CAD"
청호나이스,                                청호나이스(주) 서비스센터 설치/AS매니저(신입/경력) 채용,신입·경력1년↑,학력무관,경기 외,경기 오산시 외,~01/14(금),"AS, 렌탈, 검사, 설치, 수리, 유지보수, 정비"
㈜호텔롯데 롯데리조트,                                ㈜호텔롯데 롯데리조트 예약담당 채용,신입·경력,고졸↑,서울,서울 중구,~01/03(월),"리조트, 호텔, 안내, 안내데스크, 인포메이션, 고객상담, 고객응대, 고객지원, 여행상품, 호텔·콘도, CS, 고객관리, 회원관리, 안내, 프런트, 예약·발권, 여행사무, 호텔사무, 객실담당"
트랜스코스모스코리아,                                [틱톡] 모니터링센터 경력직 Trainer(교육강사) 채용 (명동/영어가능자) Nt5A                            ,경력1년↑,학력무관,서울,서울 중구 외,~12/29(수),"소셜네트워크서비스(SNS), 인터넷방송, 커뮤니티, 컨텐츠, 포털, CS교육, QA, 콜센터관리, 콜센터운영, 콜통계분석, 게시판관리, 웹사이트운영, 카페·블로그관리, 컨텐츠관리, 컨텐츠에디터, 관광통역, 영어, 외화번역, 통역"
트랜스코스모스코리아,                                [한국/틱톡] 모니터링센터 STAFF (Trainer / 통번역) 채용 (명동/직무선택)  Nt5A                            ,경력1년↑,학력무관,서울,서울 중구 외,~12/29(수),"소셜네트워크서비스(SNS), 인터넷방송, 커뮤니티, 컨텐츠, 포털, CS교육, QA, 콜센터관리, 콜센터운영, 콜통계분석, 게시판관리, 웹사이트운영, 카페·블로그관리, 컨텐츠관리, 컨텐츠에디터, 관광통역, 영어, 외화번역, 통역"
㈜신세계티비쇼핑,                                모바일 뷰티MD 경력사원 채용,경력,학력무관,서울,서울 성동구,~01/10(월),"모바일 뷰티MD, MD"
㈜케이티엠앤에스,                                (주)케이티엠엠에스 KT직영점 컨설턴트 채용 울산전직역                            ,경력무관,학력무관,울산,울산 동구,~03/28(월),"모바일, 무선통신, 스마트폰, 휴대전화영업"
㈜웅진씽크빅,                                [ARpedia] 해외 마케팅/판매(아마존) 담당자 채용,경력2년↑,학력무관,서울,서울 중구,~01/04(화),"글로벌마케팅, 아마존, 해외판매, 모바일, 모바일App, 스마트폰, 안드로이드, 마케팅, 마케팅기획, 수출입계약, 영어, 해외마케팅, 해외영업, MD, 상품기획, 상품입출고, 온라인MD, 유통관리, 재고관리"
㈜KG에듀원,                                [아이티뱅크 평생교육원] 마케팅기획 / 학습설계 각 부문 채용,경력무관,초대졸↑,서울,서울 종로구,~03/28(월),"e러닝, IT학원, 수강생관리, 회원관리, 교육행정, 교육프로그램, 평생교육사"
㈜제너시스BBQ,                                [GNS올떡(제너시스BBQ그룹)] 올떡 매장관리 SV / 점포개발 경력사원 채용,경력,대졸↑,서울,서울 송파구 외,~01/31(월),"프랜차이즈, 가맹점관리, 대리점관리, 매출관리, 영업관리, 영업기획, 매장시설관리, 매출관리, 샵마스터, 판매관리, 판매영업"
㈜셀바스에이아이,                                [셀바스AI] C++ 개발 경력 채용,경력3년↑,초대졸↑,서울,서울 금천구,~01/31(월),"음성합성, 음성인식, 모바일앱개발, 소프트웨어개발, 솔루션, BigData, 응용프로그래머, C, C++, Embedded, Linux, 어셈블리, 임베디드, 소프트웨어"
신세계프라퍼티,                                경력 채용,경력,학력무관,서울,서울 강남구,~01/09(일),"공사, 보건, 부동산금융, 사업인허가, 사업기획, 신규사업·BD, 산업안전, 안전"
㈜웅진씽크빅,                                [웅진씽크빅] 전사 브랜드 광고/마케팅 담당자 채용,경력3년↑,대졸↑,경기,경기 파주시,~01/04(화),"광고기획, SA, SNS, 모바일, 모바일App, 스마트폰, 안드로이드, 마케팅, 마케팅기획, 바이럴마케팅, 브랜딩, 소셜미디어, 광고관리, 브랜드, 홍보, 홍보기획, SNS운영"
한국장애인고용공단,                                부산지역본부 기간제 근로자(체험형 청년인턴) 채용,신입,학력무관,부산,부산 부산진구,~01/03(월),"전화업무, 컴퓨터프로그램/엑셀/한글, 사무행정, 경영지원"
두산매거진,                                얼루어편집팀 R&P 에디터 경력채용,경력,학력무관,서울,서울 강남구,~12/30(목),"디지털마케팅, 에디터, 콘텐츠기획, 전략, SNS운영, 컨텐츠관리, 컨텐츠에디터"
㈜원익큐브,                                ㈜원익큐브 안전보건환경(SHE) 경력자 채용,경력3년↑,학력무관,충북,충북 청주시,~01/27(목),"㈜원익큐브, SHE, 안전, 환경관리"
㈜에이스프로젝트,                                [컴투스프로야구for매니저] 게임 엔진 기획자 채용,경력무관,고졸↑,서울,서울 중구,~01/08(토),"게임개발, 게임소프트웨어, 게임개발, 게임기획, 모바일게임"
(주)DHL코리아,                                [성수/서초/송파/수원/평택/천안] DHL 쿠리어(배송) 신입 채용,경력무관,고졸↑,서울 외,서울 성동구 외,상시채용,"물류, 항공운송, 국제물류, 물류, 물류관리, 배송, 택배"
㈜에이스프로젝트,                                [컴투스프로야구for매니저] 이펙트 디자이너 채용,경력2년↑,학력무관,서울,서울 중구,~02/28(월),"2D디자인, 게임개발, 게임기획, 게임소프트웨어, 모바일앱게임, 게임개발, 게임기획, 게임디자인, 모바일게임, 캐주얼게임, 3D, 그래픽디자인, 디렉터, 포토샵, GUI, 2D, 3D, 모션그래픽, 애니메이션, 애니메이터"
메타넷엠플랫폼,                                [신규오픈] 사람인 채용공고 퍼블리셔 사원채용,경력무관,학력무관,서울 외,서울 중구 외,~01/07(금),"어도비, UI·UX디자인, 취업포털, 컨텐츠, 포털, 웹접근성, 웹퍼블리셔, 웹표준, CSS, HTML코딩, 드림위버, 웹UI, 포토샵, CSS, HTML"
메타넷엠플랫폼,                                [아이나비] QA강사 채용,경력,학력무관,경기 외,경기 성남시 외,~03/28(월),"팀장, SV, 정보처리, Excel, OA, 고객상담, 고객응대, 신용카드회사, 콜센터, CS, 수퍼바이저, CS교육, QA, 콜센터관리, 콜센터운영"
㈜신원,                                (주)신원 e-Biz사업부 여성복 온라인 상품기획MD 경력 채용,경력3년↑,초대졸↑,서울,서울 마포구,~01/09(일),"남성의류, 섬유, 여성의류, 의류, 패션, 온라인MD, 패션MD, MD, 의류, 패션"
㈜신원,                                (주)신원 e-Biz사업부 자사몰 웹디자이너 경력 채용,경력2년↑,초대졸↑,서울,서울 마포구,~01/09(일),"남성의류, 섬유, 여성의류, 의류, 패션, 일러스트레이터, 포토샵, CSS, HTML, UI·UX디자인, 의류, 패션"
㈜쎌바이오텍,                                [Bio건강기능식품] 약국/병의원 영업(강원) 경력직 채용,경력1년↑,대졸↑,서울 외,서울 서초구 외,~01/27(목),"건강식품, 식품가공, 국내영업, 일반영업, 제약영업"
㈔굿네이버스 인터내셔날,                                사단법인 굿네이버스 인터내셔날 경영지원실 인재개발팀 시간제계약직 채용 공고                            ,신입,학력무관,서울,서울 영등포구,~01/06(목),"NGO, 4대보험, 경영지원, 회계"
한국장애인고용공단,                                2022년도 보조공학센터 기간제 근로자 채용,신입·경력,초대졸↑,서울,서울 영등포구,~01/05(수),"보조공학, 전자설계, 산업디자인/금형디자인/금속디자인, 제품디자인/3D디자인, 기계설계, 전기설계, 물리치료사, 작업치료사, 재활교사"
두산퓨얼셀,                                공정품질 경력채용,경력,대졸↑,전북,전북 익산시 외,~01/07(금),품질관리
엘지전자㈜,                                [VS본부] 2022년 자동차 전장 SW분야 채용연계형 인턴 모집                            ,신입,대졸↑,서울,서울 서초구,~01/16(일),"소프트웨어, 전기·전자, 기계·자동차"
한국장애인고용공단,                                2022년도 고용환경부 BF인증팀 기간제 근로자 채용,신입·경력,학력무관,경기,경기 성남시,~01/05(수),"기사/산업기사, 실내건축, 건축설비"
오픈갤러리,                                [운전병 출신 선호] 물류팀 인턴채용(6개월 단기)                            ,경력무관,학력무관,서울,서울 송파구 외,~12/29(수),"배송, 운전기사, 설치"
㈜GS리테일,                                [GS리테일] 조직문화서비스팀 부담당(사무보조) 채용,경력무관,학력무관,서울,서울 강남구,~01/21(금),"편의점, 문서작성, 사무보조, Excel, OA, PowerPoint"
오픈갤러리,                                [미술스타트업] 비대면 고객 상담(CS) 직원 채용(신입환영)                            ,경력무관,학력무관,서울,서울 성동구,~12/29(수),"고객관리, 쇼핑몰, 해피콜, 회원관리, 고객상담, 고객응대, 인바운드TM, CS"
오픈갤러리,                                [미술스타트업] 물류/설치팀 스타렉스 운전가능자 채용(경력 무관)                            ,경력무관,학력무관,서울,서울 송파구 외,~12/29(수),"배송, 운전기사, 설치"
휴젤㈜,                                휴젤(주) 화장품상품기획팀 품질/허가 직무 채용,경력무관,학력무관,서울,서울 강남구,~01/31(월),"바이오, 의약, 제약, 상품기획"
Spoqa,                                (주) 스포카 도도 카트 사업팀 운영 인턴 채용(체험형)                            ,신입,학력무관,서울,서울 강남구,~01/09(일),"국내영업, 식품영업, 일반영업, 기술영업, 솔루션영업, 가맹점관리, 거래처관리, 영업관리"
한국장애인고용공단,                                전남지사 기간제 근로자(체험형 청년인턴) 채용,신입,학력무관,전남,전남 목포시,~01/03(월),"전화업무, 컴퓨터프로그램/엑셀/한글, 사무행정, 경영지원"
㈜누리온,                                (주)누리온 재무회계 경력직 채용,경력,초대졸↑,경기,경기 안산시,~02/26(토),"조명, 4대보험, 결산, 경영지원, 세무, ERP운용, 결산, 자금조달, 재무, 재무기획, 재무회계"
삼성웰스토리㈜,                                단체식 영양사 계약직 경력사원 채용,경력,학력무관,전국,전국,~01/04(화),"골프장, 영양사, 조리사"
㈜휴넷,                                2022년 ㈜휴넷 이러닝교육운영 담당자 채용,경력,초대졸↑,서울,서울 구로구,~01/09(일),"기업교육운영, 이러닝, 기업교육, e러닝, 교육, 교육기획, 교육훈련, 직무분석, HRD, HRM, 교육기획, 교육진행, 교육행정, 교육프로그램"
삼성웰스토리㈜,                                단체식 조리사 계약직 경력사원 채용,경력,대졸↑,경기,경기 용인시 외,~01/04(화),"골프장, 영양사, 조리사"
에스티팜,                                각 부문별(신약/사업/생산/연구) 채용,신입·경력,초대졸↑,서울 외,서울 강남구 외,~01/02(일),"산업안전, 사업개발, 소방안전, 신약개발, 안전관리, 임상시험, 생산, 품질, 바이오, 의약품, 연구·실험·기술, 제조·공정"
㈜한국종합기술,                                행정사무담당 단기직원 채용,경력무관,학력무관,서울,서울 강동구,~01/04(화),"네트워크보안, 방화벽, 정보보안, 사무관리, 사무행정, 총무"
삼성웰스토리㈜,                                단체식 조리사/영양사 계약직 경력사원 채용,경력,학력무관,전국,전국,~01/04(화),"골프장, 영양사, 조리사"
한국장애인고용공단,                                2022년 경남지사 상반기 기간제 근로자(체험형 청년인턴) 채용,신입,대졸↑,경남,경남 창원시,~01/03(월),"전화업무, 컴퓨터프로그램/엑셀/한글, 사무행정, 경영지원"
㈜유영제약,                                [제약영업] 호남병원팀 및 광주팀 신입 또는 경력직원 채용,신입·경력,대졸↑,광주 외,광주 광산구 외,~01/09(일),"의약품, 전문의약품, ETC, 바이오, 의약, 제약, 국내영업, 일반영업, 제약영업, 일반영업, 제약영업"
㈜유영제약,                                RA팀 의약품 인허가 담당 경력직원 채용,경력5년↑,학력무관,서울,서울 서초구,~01/09(일),"개발기획, 인허가, 전문의약품, 제제연구, BD, RA, 바이오, 의약, 제약, 제약, 의료·제약"
지에스건설㈜,                                2022년 주택(CS)인력 채용,경력,학력무관,서울,서울 종로구,~01/09(일),"건설, 디자인, 상품개발, 주택, IT 시스템 개발, 공무"
한국장애인고용공단,"                                22년도 광주지역본부 고용계획, 부담금 기간제 근로자 채용",신입·경력,학력무관,광주,광주 서구,~01/03(월),"전화업무, 컴퓨터프로그램/엑셀/한글, 사무행정, 경영지원"
하이트진로㈜,                                하이트진로㈜ 대구지점 사무보조 채용,경력무관,고졸↑,대구,대구 서구,~03/27(일),식품가공
㈜정도유아이티,                                (주)정도유아이티 도시계획분야(경력직) 채용 공고                            ,경력3년↑,대졸↑,서울 외,서울 강남구 외,~01/11(화),"DBA, 도시계획"
한국장애인고용공단,                                제주지사 기간제 근로자(체험형 청년인턴) 채용,신입,학력무관,제주,제주 제주시,~01/03(월),"전화업무, 컴퓨터프로그램/엑셀/한글, 사무행정, 경영지원"
삼성웰스토리㈜,                                부문별(골프장 홀관리) 경력사원 채용,경력,대졸↑,전국,전국,~01/04(화),"골프장, 조리사, 파티쉐"
㈜코리아인,                                [차고지:여의도] 임원 수행기사 채용,경력,학력무관,서울 외,서울 영등포구 외,~12/29(수),"전기, 수행기사, 승용기사, 운전기사"
현대머티리얼,"                                2022년 신입사원 채용 (재무팀-자금관리, 외국환 관리)                            ",신입,학력무관,서울,서울 강남구,~01/10(월),"세무회계, 자금관리, 해외법인, 기획, 전략, 결산, 재무, 재무회계"
㈜트랜스코스모스,                                [팀장/강사] K-Car 고객센터 관리자 채용 rNi9                            ,경력,학력무관,서울,서울 영등포구 외,~12/29(수),"상품기획, 소셜커머스, 쇼핑몰, 오픈마켓, 전자상거래, 고객상담, 고객지원, 인바운드TM, 콜센터, CS, 수퍼바이저, CS교육, 콜센터관리, 통화품질관리, 고객문의분석, 게시판관리, 쇼핑몰, 웹사이트운영, 컨텐츠관리, Helpdesk"
현대머티리얼,"                                2022년 신입사원 채용 (재무팀-회계, 결산)                            ",신입,고졸↑,서울,서울 강남구,~01/10(월),"세무회계, 자금관리, 해외법인, 기획, 전략, 결산, 재무, 재무회계"
㈜정도유아이티,                                (주)정도유아이티 스마트도시컨설팅부 경력 사원 채용 공고                            ,경력3년↑,대졸↑,서울,서울 강남구,~01/11(화),"스마트도시, 정보통신, 도시계획"
㈜트랜스코스모스,                                [신규오픈] 11번가 고객센터 관리자(실장/팀장/QA/강사) 채용 ro5N                            ,경력1년↑,초대졸↑,서울,서울 관악구 외,~12/29(수),"마트, 물류, 유통, 할인점, 홈쇼핑, 교육, 교육훈련, 성과관리, 인사기획, HRD, 고객상담, 고객응대, 고객지원, 인바운드TM, 콜센터, 수퍼바이저, CS교육, QA, 콜센터관리, 통화품질관리"
삼성웰스토리㈜,                                부문별(골프장 조리사) 경력사원 채용,경력,학력무관,전국,전국,~01/04(화),"골프장, 조리사, 파티쉐"
㈜세일코리아넷,                                [정규직] 홈쇼핑 고객센터 관리자 채용 (주5일/노원역 역세권 근무)                            ,경력,학력무관,서울,서울 노원구 외,~03/28(월),"아웃소싱, 콜센터, 보험, 쇼핑몰, 아웃바운드TM, 해피콜, 홈쇼핑, 고객상담, 고객응대, 인바운드TM, 콜센터, CS, CS교육, QA, 콜센터관리, 통화품질관리"
현대머티리얼,                                2022년 신입사원 채용 (글로벌사업개발팀)                            ,신입,대졸↑,서울,서울 강남구,~01/10(월),"세무회계, 자금관리, 해외법인, 기획, 전략, 결산, 재무, 재무회계"
현대머티리얼,"                                2022년 경력사원 채용 (재무팀-재무회계, 세무회계)                            ",경력,대졸↑,서울,서울 강남구,~01/10(월),"세무회계, 자금관리, 해외법인, 기획, 전략, 결산, 재무, 재무회계"
삼성웰스토리㈜,                                부문별(파티쉐) 경력사원 채용,경력,학력무관,경기,경기 성남시,~01/04(화),"골프장, 조리사, 파티쉐"
씨에이치솔루션㈜,                                SK E&S[대기업/본사] 수행기사 채용,경력무관,학력무관,서울,서울 종로구 외,~12/30(목),"석유화학, 에너지, 화학, 환경, 수행기사, 운전기사"
현대머티리얼,"                                2022년 경력사원 채용 (재무팀-일반기획, 관리회계, 사업지원)                            ",경력,대졸↑,서울,서울 강남구,~01/10(월),"세무회계, 자금관리, 해외법인, 기획, 전략, 결산, 재무, 재무회계"
삼성웰스토리㈜,"                                부문별(파티쉐, 골프장 조리사/홀관리) 경력사원 채용",경력,학력무관,전국,전국,~01/04(화),"골프장, 조리사, 파티쉐"
현대머티리얼,                                2022년 경력사원 채용 (글로벌사업개발팀)                            ,경력,대졸↑,서울,서울 강남구,~01/10(월),"세무회계, 자금관리, 해외법인, 기획, 전략, 결산, 재무, 재무회계"
메가스터디㈜,                                메가스터디 단체급식 본사 운영팀 경력 채용,경력3년↑,초대졸↑,서울,서울 서초구,~01/27(목),"단체급식, 가맹점관리, 거래선개발관리, 납품관리, 영업관리, 영업지원, 고객관리, 단체급식, 식품업체, 영양사, 조리사"
㈜골든듀,                                (주)골든듀 세일즈프로 채용 - 갤러리아대전점                            ,신입·경력,고졸↑,대전 외,대전 서구 외,~01/03(월),"보석감정, 주얼리판매, 면세점, 백화점, 숍마스터, 판매, 고객관리, 매장관리, 샵마스터, 잡화판매, 판매관리, 주얼리, 면세점"
㈜골든듀,                                (주)골든듀 주얼리 디자이너 경력직 채용(상시채용)                            ,경력,학력무관,서울,서울 서초구 외,~01/03(월),"백화점, 유통관리, 잡화매장, 판매, MD, 패션, 잡화, 주얼리, 액세서리, 귀금속디자인"
㈜골든듀,                                (주)골든듀 세일즈프로 채용 - 서울/경기지역                            ,신입·경력,고졸↑,서울,서울 서초구,~01/03(월),"보석감정, 주얼리판매, 면세점, 백화점, 숍마스터, 판매, 고객관리, 매장관리, 샵마스터, 잡화판매, 판매관리, 주얼리, 면세점"
현대머티리얼,                                2022년 신입 및 경력사원 채용,신입·경력,대졸↑,서울,서울 강남구,~01/10(월),"세무회계, 자금관리, 해외법인, 기획, 전략, 결산, 재무, 재무회계"
깨끗한나라㈜,                                [깨끗한나라] 구매·자재·물류 계약직 채용(경력무관)                            ,경력무관,고졸↑,서울,서울 용산구,~01/03(월),"제지, 구매관리"
메타넷엠플랫폼,                                [신규오픈] 사람인 채용공고 디자인/수정 사원채용,경력무관,고졸↑,서울 외,서울 중구 외,~03/28(월),"어도비, UI·UX디자인, 취업포털, 컨텐츠, 포털, 웹접근성, 웹퍼블리셔, 웹표준, CSS, HTML코딩, 드림위버, 웹UI, 포토샵, CSS, HTML"
코웨이,                                코웨이 홈케어닥터 [생활환경지도사/수면환경관리사] 채용.                            ,경력무관,고졸↑,경기 외,경기 의정부시 외,~03/28(월),"대여, 렌탈, 임대, 국내영업, 법인영업, 일반영업, 렌탈영업, 유지보수"
㈜케이지이니시스,                                [KG이니시스] 정산팀 경력직 채용,경력2년↑,초대졸↑,서울,서울 중구,~01/27(목),"계산서발행, 입금정산, 소프트웨어개발, 솔루션, 상품기획, 소셜커머스, 쇼핑몰, 전자상거래, B2B, 네트웍구축, 통신, 전산회계"
㈜링네트,                                네트워크 영업 신입/경력 채용,신입·경력1년↑,초대졸↑,서울,서울 구로구,~03/28(월),"스토리지, 유지보수, 컴퓨터, 하드웨어, 국내영업, 기술영업, 일반영업, 장비영업, 기술영업, 기술지원, 네트워크영업, 시스템영업, 기술영업, 법인영업, 일반영업, 장비영업"
㈜링네트,                                [링네트] 네트워크 엔지니어 채용,경력,학력무관,서울,서울 구로구,~03/28(월),"네트웍구축, 통신, IDC, 네트워크관리, 네트워크엔지니어, 방화벽, CCNA, Cisco, 유지보수, 하드웨어, 소프트웨어"
㈜링네트,                                [정규직] 춘천 상주 네트워크 엔지니어 채용,경력1년↑,초대졸↑,강원,강원 춘천시,~01/27(목),"유지보수, 컴퓨터, 하드웨어, AS, 네트워크관리, 네트워크엔지니어, 서버관리자, 서버구축, Cisco"
트랜스코스모스코리아,"                                [평일근무]카카오커머스 고객센터 민원팀, QA, 관리팀장 채용 mj3P                            ",경력,학력무관,서울,서울 용산구 외,~12/29(수),"카카오, 소셜커머스, 쇼핑몰, 오픈마켓, 전자상거래, 교육, 교육기획, 교육훈련, 목표관리, 성과관리, 전산입력, Excel, OA, PowerPoint, QA, 콜센터관리, 콜센터운영, 통화품질관리, 콜통계분석"
코웨이,"                                코웨이 홈케어닥터 공개채용(도봉,강북,성북,노원,동대문,중랑)                            ",경력무관,학력무관,서울,서울 도봉구 외,~03/28(월),"대여, 렌탈, 임대, 국내영업, 일반영업, 렌탈영업"
현대로보틱스,                                경력사원 공개채용,경력,대졸↑,대구 외,대구 달성군 외,~01/17(월),"기술영업, 상품기획, 소프트웨어, 구매, 로봇설계, 로봇제어, 아키텍쳐, UI, 마케팅, C++, 기구설계, CAD"
메타넷엠플랫폼,                                [상위권 500만이상 ] 삼성카드 프리미엄 발급사원 채용,신입·경력,고졸↑,서울 외,서울 중구 외,~01/10(월),"2호선, 삼성카드, 정규직, 콜센터, 전산입력, 정보처리, Excel, 신용카드, 아웃바운드TM, 해피콜, 회원관리, 고객상담, 고객응대, 신용카드회사, 인바운드TM, CS"
하나캐피탈㈜,"                                [금융/캐피탈] 하나캐피탈 자산관리팀 직원 채용 공고 (송무, 여신, 위임사 관리)                            ",경력,학력무관,서울,서울 서초구,~01/09(일),"사무행정, 송무, 자산관리, 소송·민사·등기, 채권관리, 금융사무, 담보, 여신, 채권관리, 채권추심"
주식회사 씨젠,                                (주)씨젠 경력직/정규직 연구원 채용 [진단시약개발/연구]                            ,경력3년↑,석사↑,서울,서울 송파구,~01/16(일),"건강, 바이오, 생명공학, 의약, 제약, 바이오, 생명공학, 의료·제약"
