기업명,내용,고용형태,경력,주소1,주소2,기간,직무키워드
㈜비아트론,                                반도체CVD장비 설계 / CS 경력직 채용,경력5년↑,대졸↑,경기,경기 수원시,~01/23(일),"디스플레이, 반도체, 공정관리, 기구설계, 디스플레이, 반도체, 제품개발, R&D, 기계설계, 기구설계, CAD, catia, Pro-e"
㈜안트로젠,                                경영지원업무 경력사원 채용 - 정규직                            ,경력10년↑,대졸↑,서울,서울 강서구,~01/19(수),"건강, 바이오, 생명공학, 의약, 제약, 4대보험, 경리, 급여관리, 전표입력, 출납"
현대무벡스㈜,                                경력사원 상시채용(국내영업)                            ,경력,학력무관,서울,서울 종로구,상시채용,"경영지원, 물류영업, 물류자동화, IT, 국내영업, 기술영업, Python, 인공지능(AI), 빅데이터, 데이터분석, 기계, 기구설계, 생산기술, 제어, 제품개발"
㈜동원와인플러스,                                동원 와인플러스 편집 디자이너 채용(정규직)                            ,경력무관,대졸↑,서울,서울 서초구,~01/23(일),"유통, 유통관리, 판매, MD, 시각디자인, 인디자인"
한화임팩트㈜,                                해외영업 경력채용,경력,대졸↑,서울,서울 중구,~01/05(수),"판매관리, 해외영업, 채권관리"
㈜삼성화학,                                경리 사무직원 채용,경력2년↑,대졸↑,경기,경기 광주시,~01/23(일),"프라스틱제조, 경리, 무역사무"
홈플러스㈜,                                본사 재무부문 재무결산팀 결산담당자 채용 (경력)                            ,경력5년↑,대졸↑,서울,서울 강서구,~03/24(목),"마트, 물류, 유통, 유통관리, 결산, 내부통제, 재무, 재무기획"
에스앤아이건설,                                건축/설비/전기/안전 경력사원 정규 채용 (안전관리)                            ,경력,대졸↑,전국 외,전국,~01/14(금),"산업안전(산업)기사, 건설안전(산업)기사, 건축시공, 건축설비, 기계설비, 소방설비, 전기설비, 통신설비"
에스앤아이건설,                                건축/설비/전기/안전 경력사원 정규 채용 (전기시공)                            ,경력,학력무관,전국 외,전국,~01/14(금),"산업안전(산업)기사, 건설안전(산업)기사, 건축시공, 건축설비, 기계설비, 소방설비, 전기설비, 통신설비"
에스앤아이건설,                                건축/설비/전기/안전 경력사원 정규 채용 (설비시공)                            ,경력,학력무관,전국 외,전국,~01/14(금),"산업안전(산업)기사, 건설안전(산업)기사, 건축시공, 건축설비, 기계설비, 소방설비, 전기설비, 통신설비"
한섬,                                현대백화점그룹 (주)한섬 트렌디마케팅팀 계약직 경력채용 (3년 이상)                            ,경력3년↑,대졸↑,서울,서울 강남구,~03/24(목),"여성의류, 의류, 직물·우븐·데님, 패션, 마케팅"
에스앤아이건설,                                건축/설비/전기/안전 경력사원 정규 채용 (건축시공)                            ,경력,대졸↑,전국 외,전국,~01/14(금),"산업안전(산업)기사, 건설안전(산업)기사, 건축시공, 건축설비, 기계설비, 소방설비, 전기설비, 통신설비"
㈜ 메타넷엠플랫폼,                                [메타넷엠플랫폼]컨택센터 운영/영업관리 AM 채용,경력무관,학력무관,서울,서울 중구 외,~01/07(금),"아웃소싱, 콜센터 AM, AM, 콜센터, 마케팅, 마케팅기획, CRM, 거래선개발관리, 거래처관리, 고객관리, 매출관리, 영업관리, 수퍼바이저, CS교육, 콜센터관리, 콜센터운영"
㈜ 메타넷엠플랫폼,                                콜센터 상담 솔루션 개발자 경력직 채용,경력무관,학력무관,서울,서울 중구 외,~01/07(금),"jquery, Nodejs, vuejs, 콜센터, 웹프로그래머, HTML, Java, MySQL, .NET, CTI, Linux, 웹퍼블리셔, 자바스크립트, CSS, HTML5, HTML코딩"
㈜ 메타넷엠플랫폼,                                ABC마트 고객센터 매니저 채용,경력,학력무관,서울 외,서울 동작구 외,~01/07(금),"콜센터, 고객상담, 고객응대, 인터넷쇼핑몰, 콜센터, CS, 수퍼바이저, CS교육, 콜센터관리, 콜센터운영, 통화품질관리"
에스앤아이건설,                                건축/설비/전기/안전 경력사원 정규 채용,경력,대졸↑,전국 외,전국,~01/14(금),"산업안전(산업)기사, 건설안전(산업)기사, 건축시공, 건축설비, 기계설비, 소방설비, 전기설비, 통신설비"
삼성웰스토리㈜,                                인테리어 디자이너 계약직 경력사원 채용,경력,학력무관,충남,충남 아산시,~01/03(월),"인테리어, 인테리어설계, 인테리어시공"
㈜ 메타넷엠플랫폼,                                [메타넷엠플랫폼]교육강사 경력직 채용,경력,학력무관,서울 외,서울 종로구 외,~12/31(금),"고객상담, 콜센터, CS, 수퍼바이저, CS교육, QA, 콜센터관리, 통화품질관리"
에스케이엠앤서비스 주식회사,                                [SK엠앤서비스-커머스 컨택센터] PI 경력 채용,경력,고졸↑,서울,서울 금천구,~01/07(금),"콜센터관리, 콜센터운영, 통화품질관리, 콜통계분석, 고객문의분석, 웹기획, 웹서비스기획, PM, 게시판관리, 쇼핑몰, 웹사이트운영, 카페·블로그관리, 컨텐츠관리"
㈜티시스,                                [태광그룹 티시스] 흥국생명 신문로사옥 전기기사 채용,경력5년↑,초대졸↑,서울,서울 종로구,~03/24(목),"전기기사, 유지보수, 빌딩관리, 전기관리"
㈜미래아이엔씨,"                                (기본급 250/인센지급) 온라인마케팅 AE 채용, 카카오/네이버공식대행사                            ",경력무관,대졸↑,부산,부산 부산진구 외,~01/07(금),"광고기획, 광고대행, 온라인광고, 홍보대행, 키워드광고, 검색광고, 광고영업, 매체광고영업, 온라인광고영업, 키워드광고, 온라인마케팅, 키워드광고"
SK에코플랜트㈜,                                [SK에코플랜트] 반도체 플랜트 설계 및 시공 채용,경력5년↑,초대졸↑,서울,서울 종로구,~01/05(수),"건축설계, 건축시공, 교량설계, 설계감리, 시공, 토목"
한국환경공단,                                강원환경본부 수탁폐수 전자인계관리시스템 운영사업 기간제근로자 채용 재공고                            ,신입·경력,학력무관,강원,강원 춘천시,~01/06(목),"기사/산업기사, 공공기관, 공기업, 폐기물처리"
㈜프레시지,                                (주)프레시지 유통담당 제조영업팀 경력직 채용,경력1년↑,학력무관,경기 외,경기 용인시 외,~12/31(금),"국내영업, 납품영업, 법인영업, 식품영업, 일반영업, 가맹점관리, 거래선개발관리, 거래처관리, 고객관리, 영업관리, 기술영업, 납품영업, 법인영업, 식품영업, 일반영업"
(재)서울예술실용전문학교,                                서울예술실용전문학교 총무처 채용 공고                            ,경력2년↑,초대졸↑,서울 외,서울 서대문구 외,~12/31(금),"문서관리, 문서수발, 사무행정, 총무, 문서작성, 사무보조, 전산입력, 4대보험, 급여관리, 더존, 회계"
한국환경공단,                                부산울산경남환경본부 수탁폐수 전자인계인수관리시스템 운영사업 기간제근로자 채용 재공고                            ,신입·경력,학력무관,부산,부산 북구,~01/06(목),"기사/산업기사, 공공기관, 공기업, 폐기물처리"
㈜조선호텔앤리조트,                                (주)조선호텔앤리조트 사업기획 경력직 채용,경력5년↑,학력무관,서울,서울 중구,~01/03(월),"호텔, 사업기획"
㈜한진,                                (주)한진  물류전문인턴(택배사업) 인재 채용,신입,학력무관,경기 외,경기 용인시 외,~01/31(월),"물류, 물류관리, 물류센터, 배송, 육상운송, 물류, 배차, 창고관리, 물류, 물류관리, 창고관리, 택배"
나이스손해사정㈜,                                [삼성화재 전속법인] 나이스손해사정 서울지사 인보험 인력채용,신입·경력1년↑,초대졸↑,서울,서울 영등포구,~03/24(목),"손해보험, 손해사정, 손해사정, 보험심사"
엔에이치엔애드㈜,                                [NHN AD] 애드테크 솔루션 기획자 신입 채용,신입,학력무관,경기,경기 성남시,~03/24(목),"애드테크, 애드테크기획, 애드테크 솔루션, 애드테크 솔루션 기획, 광고기획, 광고대행, 광고제작, 온라인광고, 홍보대행, 기획, 기획조사, 서비스기획, 광고기획, 마케팅, 마케팅기획, 키워드광고, AE, 모바일기획, 웹기획, 웹서비스기획"
크루셜텍㈜,                                크루셜텍(주) 해외영업(일본) 경력 채용,경력5년↑,대졸↑,경기,경기 성남시,~01/23(일),"해외영업(일본), 거래처관리, 영업관리, 영업기획"
온라인팜㈜,                                [한미약품 그룹] 온라인팜(주) 본사 HMP몰팀 채용,경력2년↑,대졸↑,서울,서울 송파구,~01/09(일),"제약, 데이터분석"
㈜글로벌유명,                                (주)글로벌유명 건축직 신입사원 정규직 채용,신입,학력무관,경기 외,경기 평택시 외,~01/09(일),"건설, 공무, 시공관리, 플랜트, 3DMax, 건축설계, 건축시공, 실내건축, 인테리어설계, CAD, 공무, 시공, 시공감리, 현장소장, 건설안전, 산업안전, 안전, 품질관리"
대방건설,                                대방건설(주) 양주옥정3차 보건관리자 채용공고                            ,경력무관,초대졸↑,경기,경기 양주시,~03/24(목),"건설안전, 산업안전, 건설현장, 건설안전, 산업안전, 안전, 간호사, 산업간호사"
나이스손해사정㈜,                                [삼성화재 전속법인] 나이스손해사정 대전지사 인력채용,신입·경력1년↑,학력무관,대전,대전 서구,~01/31(월),"손해보험, 손해사정, 손해사정, 보험심사"
㈜케이티씨에스,                                [수도권지역] LX하우시스 제품강사 채용,신입·경력,학력무관,서울 외,서울 동작구 외,~12/30(목),"강사, 교육강사, 세일즈강사, ㈜케이티씨에스, QA강사, 마트, 유통, 전자제품대리점, 통신기기대리점, 판매, 교육기획, 교육훈련, 인재개발, 국내영업, 일반영업, 가전판매, 통신기기판매, 판매관리, 홍보판촉, 고객상담, 고객응대, CS, 단순홍보, 제품홍보, CS교육, QA, 고객문의분석"
한국환경공단,                                본사 수탁폐수 전자인계인수관리시스템 운영사업 기간제근로자 채용 재공고                            ,신입·경력,고졸↑,인천,인천 서구,~01/10(월),"기사/산업기사, 공공기관, 공기업, 폐기물처리"
㈜Korea Instrument,                                [복지/커리어/청년내일채움공제] 반도체장비 생산 정규직 추가채용 [제조/설비]                            ,신입·경력,고졸↑,경기 외,경기 화성시 외,~03/24(목),"반도체, 반도체장비, 생산, 생산관리, 품질, 품질검사, 생산직, 조립, 생산직, 포장, 기술직, 반도체, 생산기술, 전기·전자, 제품개발, 반도체·LCD"
롯데케미칼㈜,                                첨단소재사업부 여수공장 행정지원직 채용,신입,학력무관,전남,전남 여수시,~01/05(수),"석유화학, 사무행정"
주식회사 여기어때컴퍼니,                                [여기어때] Product Center 예약/결제 PO 채용 (경력)                            ,경력3년↑,고졸↑,서울,서울 강남구 외,~03/24(목),"UI·UX디자인, 모바일기획, 웹기획, 웹서비스기획, PM, 웹퍼블리셔, UI·UX, 모바일UI, 웹UI, Sketch, UI·UX디자인"
㈜포스콤,"                                품질관리, 생산기술 신입/경력직 채용",신입·경력2년↑,학력무관,경기,경기 고양시,~01/20(목),"전기, 전자, 품질, 품질검사, 품질관리, 기술지원, 수리"
청호나이스,                                물류센터(오포) 사무지원 계약직 채용,경력무관,대졸↑,경기,경기 광주시,~01/16(일),기계
한국타이어앤테크놀로지(주),                                한국타이어앤테크놀로지 관리회계 경력사원 채용,경력3년↑,대졸↑,경기,경기 성남시,~01/09(일),"자동차부품, 결산, 원가, 회계, SAP"
한국해양과학기술원 부설 극지연구소,                                2022년 상반기 기간제계약직(연구직) 공개채용 공고                            ,경력무관,고졸↑,인천,인천 연수구,~01/06(목),"연구소, 연구·실험·기술"
㈜포스콤,"                                하드웨어,펌웨어 개발 신입/경력 채용",신입·경력,학력무관,경기,경기 고양시,~01/20(목),"SMPS, 전기, 전자, 설계엔지니어, 전기, 전기·전자회로, 펌웨어, 하드웨어, 회로설계, Analog, PCB"
㈜바이오프로테크,                                (주)바이오프로테크 품질관리팀 경력 채용공고 (과장급)                            ,경력5년↑,학력무관,강원,강원 원주시,~01/23(일),"품질, 품질관리"
주식회사 여기어때컴퍼니,                                [여기어때] 고객센터 상담 시스템 기획 담당 채용 (경력)                            ,경력3년↑,대졸↑,서울,서울 강남구 외,~03/24(목),"UI·UX디자인, 모바일기획, 웹기획, 웹서비스기획, PM, 웹퍼블리셔, UI·UX, 모바일UI, 웹UI, Sketch, UI·UX디자인"
케어캠프㈜,                                [케어캠프(주)] 회계/결산 담당 직원(대전) 채용,경력5년↑,초대졸↑,대전,대전 서구,~01/03(월),"보건, 의료기기, 결산, 경영지원, 회계, 결산, 재무, 재무기획"
㈜인포바인,                                [코스닥 상장사] ASP.Net 웹개발 경력직 채용,경력5년↑,학력무관,서울,서울 영등포구,~01/31(월),".NET, 웹프로그래머, asp, ASP.NET, C#"
㈜이랜드건설,"                                [이랜드건설] 건축공사,공무/전기/기계/견적/인사/조경 경력 정규직 채용",경력,학력무관,서울,서울 마포구,~01/02(일),"건축시공, 견적, 공무, 설비, 전기, 건축시공, 조경디자인, 건설현장, 건축시공, 건축자재, 공무, 현장소장, 기계설비, 전기공사, 전기기사, 전기설비, 통신설비"
현대무벡스㈜,                                경력사원 상시채용,경력,초대졸↑,전국,전국,상시채용,"경영지원, 물류영업, 물류자동화, IT, 국내영업, 기술영업, Python, 인공지능(AI), 빅데이터, 데이터분석, 기계, 기구설계, 생산기술, 제어, 제품개발"
㈜포스콤,                                (주)포스콤 생산직 사원 채용,신입,고졸↑,경기 외,경기 고양시 외,~01/20(목),"생산, 생산관리, 생산직, 제조, 조립, 생산직"
셰어하우스우주㈜,                                (직방 계열사) 신사업 데이터 관리 매니저 (영업분석) 채용 (7시간 근무제)                            ,경력1년↑,대졸↑,서울,서울 강남구,~01/07(금),"영업분석, 도시개발, 부동산개발, 부동산서비스, 부동산컨설팅, 경영기획, 기획, 사업기획, 서비스기획"
㈜케이티서비스남부,                                대졸 신입사원 공개채용,신입,대졸↑,대전 외,대전 서구 외,~12/31(금),"경영기획, 사업기획, 신규사업·BD, 전략, 영업관리, 산업안전, 안전"
에이블현대호텔앤리조트 주식회사,                                몽상클레르코리아 베이커리 제조라인 생산직 사원 채용,신입·경력1년↑,초대졸↑,서울,서울 성동구,~01/23(일),"식품, 음식료, 제과제빵점, 베이커리, 제빵사"
㈜프레시지,                                (주)프레시지 식품안전팀 HACCP담당자 및 오디터(Audit) 경력사원 채용,경력5년↑,초대졸↑,경기,경기 용인시,~12/31(금),"GFSI, 품질, 품질검사, 품질관리, 품질보증, HACCP"
아이케이세미콘㈜,                                영업관리 직무 사원 채용공고                            ,신입·경력2년↑,초대졸↑,서울,서울 구로구,~03/24(목),"반도체, 반도체생산, 거래처관리, 고객관리, 영업관리"
키움캐피탈 주식회사,                                기업·부동산 심사 담당자 채용공고                            ,경력,대졸↑,서울,서울 영등포구,~01/09(일),"여신, 캐피탈, 대출심사, 기업심사, 투자심사"
㈜아모레퍼시픽,                                21년 경력채용 - 수요예측모델링                            ,경력,학력무관,서울,서울 용산구,~01/03(월),"Python, 머신러닝(ML), 데이터분석"
에스씨케이㈜,                                [충주]롯데주류 충주공장 현장관리 소장 채용공고                            ,경력무관,학력무관,충북,충북 충주시,~01/23(일),"경비, 시설관리, 청소·미화, 경비, 시설관리, 보안, 노무관리, 인재서치"
㈜유니에스,                                [KBS/여의도] 건축기전부 CAD 채용,경력무관,초대졸↑,서울,서울 영등포구 외,~03/24(목),"아웃소싱, 건축설계, 건축설비설계, AutoCad, CAD, 건축설계, 건축시공, 인테리어, 인테리어설계, CAD"
㈜아모레퍼시픽,                                21년 경력채용 - 마케팅 커뮤니케이션                            ,경력,초대졸↑,서울,서울 용산구,~01/05(수),"마케팅, 마케팅기획"
㈜아모레퍼시픽,                                21년 경력채용 - 리테일 영업관리                            ,경력,대졸↑,서울,서울 용산구,~01/05(수),"유통관리, MD, 영업관리"
㈜아모레퍼시픽,                                21년 경력채용 - 글로벌 디지털 전략기획                            ,경력,학력무관,서울,서울 용산구,~01/05(수),"기획, 전략, 마케팅, 마케팅기획"
금호타이어,                                `21년 12월 수시채용,신입·경력,초대졸↑,서울 외,서울 종로구 외,~01/05(수),"시스템운영, 품질보증, 물류지원, 산업공학, 실적관리, 연구기획, 영업, 자금관리, 재무, 해외영업, 영업지원"
㈜아모레퍼시픽,                                21년 경력채용 - SAP HR / Success Factors 기술 PM                            ,경력,대졸↑,서울,서울 용산구,~01/04(화),"PM, SAP"
㈜야나두,                                [야나두 마케팅본부]  유튜브 PD / 카피라이터 / 브랜드 세일즈 / CS 경력직 채용,경력2년↑,대졸↑,서울 외,서울 서초구 외,상시채용,"CS, 모바일App, 광고기획, 마케팅, 마케팅기획, 브랜딩, 소셜미디어, 브랜드, 홍보, PR, SNS운영, 단순홍보, 서비스홍보, 제품홍보, 바이럴마케팅, 소셜마케팅, 온라인마케팅, 웹광고기획, 웹프로모션, 방송기획, 방송제작, 방송편성, PD·연출, 광고기획, 광고제작, 광고PD, 아트디렉터, 카피라이터"
㈜제너시스BBQ,                                [제너시스비비큐그룹] 프랜차이즈 점포개발 경력 채용,경력3년↑,학력무관,서울 외,서울 송파구 외,~01/31(월),"프랜차이즈, 가맹점영업, 국내영업, 식품영업, 가맹점관리, 영업기획"
㈜중앙일보,                                [경력] 총무(공정관리 및 일반 총무) 채용,경력5년↑,초대졸↑,서울,서울 마포구,~01/02(일),"신문사, 언론사, 자산관리, 총무"
플레이디(구 엔서치마케팅),                                윤리경영 담당자 경력직 채용,경력3년↑,학력무관,경기,경기 성남시,~01/03(월),"윤리경영, 컴플라이언스, 광고기획, 광고대행, 광고디자인, 온라인광고, 문서관리, 법무"
㈜지니뮤직,                                [지니뮤직] 서비스 기획 경력직 채용,경력4년↑,학력무관,서울,서울 강남구,~01/14(금),"배급유통사, 음반기획, 음반배급, 음반판매, 기획, 사업기획, 서비스기획"
㈜유니에스,                                [공기업/협회/가산] 한국표준협회 가산 교육지원센터 행정보조 채용,경력무관,학력무관,서울,서울 금천구,상시채용,"아웃소싱, 사무행정, 교육행정"
한국원자력의학원,"                                [장애인 제한경쟁 채용] 별정직 직원모집 공고(재무팀, 간호부, 진단검사의학과)                            ",경력무관,학력무관,서울,서울 노원구,~01/08(토),기타의료직
㈜동양이엠에스,                                [차고지 양재/우면동] 중견기업 대표이사 수행기사 채용,경력3년↑,고졸↑,서울,서울 마포구 외,~01/10(월),"아웃소싱, 수행기사, 승용기사, 운전기사"
㈜프레시지,                                (주)프레시지 온/오프라인 상품기획 및 마케터 경력사원 채용,경력1년↑,대졸↑,서울,서울 강남구,~12/31(금),"광고기획, 마케팅, 마케팅기획, 브랜딩, 시장분석, 브랜드, 언론홍보, 홍보, 홍보기획, SNS운영, 리테일MD, 상품기획, 식품MD, 신상품개발, 온라인MD"
㈜중앙일보,                                [계약직] 듣똑라 브랜드마케터 채용,경력무관,대졸↑,서울,서울 마포구,~01/02(일),"신문사, 언론사, 마케팅, 브랜드, 홍보"
㈜비즈테크파트너스,                                [경력] VDI운영/IT보안/IT유지보수 엔지니어 채용 (T인프라 유지보수 엔지니어 : Network/UNIX 서버)                            ,경력,대졸↑,서울,서울 마포구,~01/31(월),"네트워크관리, 네트워크엔지니어"
㈜비즈테크파트너스,                                [경력] VDI운영/IT보안/IT유지보수 엔지니어 채용 (미들웨어(WAS) 엔지니어)                            ,경력,초대졸↑,서울,서울 마포구,~01/31(월),"네트워크관리, 네트워크엔지니어"
㈜비즈테크파트너스,                                [경력] VDI운영/IT보안/IT유지보수 엔지니어 채용 (IT보안)                            ,경력,초대졸↑,서울,서울 마포구,~01/31(월),"네트워크관리, 네트워크엔지니어"
㈜비즈테크파트너스,                                [경력] VDI운영/IT보안/IT유지보수 엔지니어 채용 (VDI 구축/운영)                            ,경력,대졸↑,서울,서울 마포구,~01/31(월),"네트워크관리, 네트워크엔지니어"
(주)에스와이에스리테일,                                [전자랜드] 매장 인테리어 디자인 경력직 채용,경력3년↑,초대졸↑,서울,서울 용산구,~01/14(금),"유통, 전자제품대리점, 통신기기대리점, 판매, 할인점, 공간디자인, 산업디자인, 광고디자인, 전시디자인, 공간디자인, 실내디자인, 전시디자인"
㈜비즈테크파트너스,                                [경력] VDI운영/IT보안/IT유지보수 엔지니어 채용 (클라우드 TA)                            ,경력,학력무관,서울,서울 마포구,~01/31(월),"네트워크관리, 네트워크엔지니어"
㈜비즈테크파트너스,                                [경력] VDI운영/IT보안/IT유지보수 엔지니어 채용,경력,대졸↑,서울,서울 마포구,~01/31(월),"네트워크관리, 네트워크엔지니어"
㈜웹브라이트,                                웹디자인(SNS/웹진) 디자이너 채용(대리급)                            ,경력1년↑,대졸↑,서울,서울 중구,~01/23(일),"온라인광고, 홍보대행, 일러스트레이터, 포토샵, 인디자인, 시각디자인, 영상디자인"
㈜웹브라이트,                                웹디자인(SNS/웹진) 디자이너 채용(과장급)                            ,경력3년↑,대졸↑,서울,서울 중구,~01/23(일),"온라인광고, 홍보대행, 일러스트레이터, 포토샵, 인디자인, 시각디자인, 영상디자인"
㈜야나두,                                [야나두] DevOps / 백엔드 개발 대규모 채용 (경력)                            ,경력무관,학력무관,서울 외,서울 강남구 외,상시채용,"백엔드, AWS, JPA, MSA, Network, React, spring boot, Shell Script, 소셜커머스, 쇼핑몰, 오픈마켓, 전자상거래, B2C, 데이터베이스, 데이터마이닝, HTML, Java, MS-SQL, MySQL, Python"
